<?xml version="1.0" encoding="UTF-8"?>
<!DOCTYPE Langileak SYSTEM "Langileak.dtd">
<Langileak xmlns:xsi="http://www.w3.org/2001/XMLSchema-instance"
          xsi:noNamespaceSchemaLocation="Langileak.xsd">
  <Bulegaria id="1">
  <!-- Bulegaria — Langile mota hau bulegaria da, id atributu bakarra du -->
  <Izena>Selah</Izena>
  <!-- Izena — Bulegariaren lehen izena -->
  <Abizena>Barnes</Abizena>
  <!-- Abizena — Bulegariaren abizena -->
  <Emaila>selah.barnes@example.com</Emaila>
  <!-- Emaila — Bulegariaren posta elektronikoa -->
  <Telefonoa>515.123.4567</Telefonoa>
  <!-- Telefonoa — Bulegariaren telefono zenbakia -->
  <Data>17/06/13</Data>
  <!-- Data — Bulegariari lotutako data (adibidez, kontratu data) -->
  <Nagusia nagusiID="1">
    <!-- Nagusia — Bulegariaren nagusiaren informazioa, nagusiID atributuarekin -->
    <IzenAbizena>Selah Barnes</IzenAbizena> 
    <!-- IzenAbizena — Nagusiaren izena eta abizena -->
  </Nagusia>
  <LanpostuDeskribapen>President</LanpostuDeskribapen>
  <!-- LanpostuDeskribapen — Bulegariaren lanpostuaren deskribapena -->
  <Lanpostua idLanpostu="4"></Lanpostua>
  <!-- Lanpostua — Lanpostuaren identifikatzailea, hutsik geratzen da edukia gabe -->
</Bulegaria>

  <Bulegaria id="2">
    <Izena>Keziaha</Izena>
    <Abizena>Swanson</Abizena>
    <Emaila>keziaha.swanson@example.com</Emaila>
    <Telefonoa>515.123.4568</Telefonoa>
    <Data>21/09/15</Data>
    <Nagusia nagusiID="1">
      <IzenAbizena>Selah Barnes</IzenAbizena>
    </Nagusia>
    <LanpostuDeskribapen>Administration Vice President</LanpostuDeskribapen>
    <Lanpostua idLanpostu="5"></Lanpostua>
  </Bulegaria>

  <Bulegaria id="3">
    <Izena>Fionnuala</Izena>
    <Abizena>Bond</Abizena>
    <Emaila>fionnuala.bond@example.com</Emaila>
    <Telefonoa>515.123.4569</Telefonoa>
    <Data>13/01/16</Data>
    <Nagusia nagusiID="1">
      <IzenAbizena>Selah Barnes</IzenAbizena>
    </Nagusia>
    <LanpostuDeskribapen>Administration Vice President</LanpostuDeskribapen>
    <Lanpostua idLanpostu="5"></Lanpostua>
  </Bulegaria>

  <Bulegaria id="4">
    <Izena>Selah</Izena>
    <Abizena>Barnes</Abizena>
    <Emaila>selah.barnes@example.com</Emaila>
    <Telefonoa>515.123.4560</Telefonoa>
    <Data>03/01/16</Data>
    <Nagusia nagusiID="2">
      <IzenAbizena>Keziaha Swanson</IzenAbizena>
    </Nagusia>
    <LanpostuDeskribapen>Programmer</LanpostuDeskribapen>
    <Lanpostua idLanpostu="9"></Lanpostua>
  </Bulegaria>

  <Bulegaria id="5">
    <Izena>Keziaha</Izena>
    <Abizena>Swanson</Abizena>
    <Emaila>keziaha.swanson@example.com</Emaila>
    <Telefonoa>515.123.4561</Telefonoa>
    <Data>21/05/15</Data>
    <Nagusia nagusiID="2">
      <IzenAbizena>Keziaha Swanson</IzenAbizena>
    </Nagusia>
    <LanpostuDeskribapen>Programmer</LanpostuDeskribapen>
    <Lanpostua idLanpostu="9"></Lanpostua>
  </Bulegaria>

  <Bulegaria id="6">
    <Izena>Fionnuala</Izena>
    <Abizena>Bond</Abizena>
    <Emaila>fionnuala.bond@example.com</Emaila>
    <Telefonoa>515.123.4562</Telefonoa>
    <Data>25/06/15</Data>
    <Nagusia nagusiID="2">
      <IzenAbizena>Keziaha Swanson</IzenAbizena>
    </Nagusia>
    <LanpostuDeskribapen>Programmer</LanpostuDeskribapen>
    <Lanpostua idLanpostu="9"></Lanpostua>
  </Bulegaria>

  <Bulegaria id="7">
    <Izena>Selah</Izena>
    <Abizena>Barnes</Abizena>
    <Emaila>selah.barnes@example.com</Emaila>
    <Telefonoa>515.123.4563</Telefonoa>
    <Data>05/02/16</Data>
    <Nagusia nagusiID="2">
      <IzenAbizena>Keziaha Swanson</IzenAbizena>
    </Nagusia>
    <LanpostuDeskribapen>Programmer</LanpostuDeskribapen>
    <Lanpostua idLanpostu="9"></Lanpostua>
  </Bulegaria>

  <Bulegaria id="8">
    <Izena>Keziaha</Izena>
    <Abizena>Swanson</Abizena>
    <Emaila>keziaha.swanson@example.com</Emaila>
    <Telefonoa>515.123.4564</Telefonoa>
    <Data>07/02/16</Data>
    <Nagusia nagusiID="2">
      <IzenAbizena>Keziaha Swanson</IzenAbizena>
    </Nagusia>
    <LanpostuDeskribapen>Programmer</LanpostuDeskribapen>
    <Lanpostua idLanpostu="9"></Lanpostua>
  </Bulegaria>

  <Bulegaria id="9">
    <Izena>Fionnuala</Izena>
    <Abizena>Bond</Abizena>
    <Emaila>fionnuala.bond@example.com</Emaila>
    <Telefonoa>515.124.4567</Telefonoa>
    <Data>17/08/12</Data>
    <Nagusia nagusiID="1">
      <IzenAbizena>Selah Barnes</IzenAbizena>
    </Nagusia>
    <LanpostuDeskribapen>Finance Manager</LanpostuDeskribapen>
    <Lanpostua idLanpostu="7"></Lanpostua>
  </Bulegaria>

  <Bulegaria id="10">
    <Izena>Selah</Izena>
    <Abizena>Barnes</Abizena>
    <Emaila>selah.barnes@example.com</Emaila>
    <Telefonoa>515.124.4568</Telefonoa>
    <Data>16/08/15</Data>
    <Nagusia nagusiID="9">
      <IzenAbizena>Fionnuala Bond</IzenAbizena>
    </Nagusia>
    <LanpostuDeskribapen>Public Accountant</LanpostuDeskribapen>
    <Lanpostua idLanpostu="1"></Lanpostua>
  </Bulegaria>

  <Bulegaria id="11">
    <Izena>Keziaha</Izena>
    <Abizena>Swanson</Abizena>
    <Emaila>keziaha.swanson@example.com</Emaila>
    <Telefonoa>515.124.4569</Telefonoa>
    <Data>28/09/15</Data>
    <Nagusia nagusiID="9">
      <IzenAbizena>Fionnuala Bond</IzenAbizena>
    </Nagusia>
    <LanpostuDeskribapen>Public Accountant</LanpostuDeskribapen>
    <Lanpostua idLanpostu="1"></Lanpostua>
  </Bulegaria>

  <Bulegaria id="12">
    <Izena>Fionnuala</Izena>
    <Abizena>Bond</Abizena>
    <Emaila>fionnuala.bond@example.com</Emaila>
    <Telefonoa>515.124.4560</Telefonoa>
    <Data>07/12/15</Data>
    <Nagusia nagusiID="9">
      <IzenAbizena>Fionnuala Bond</IzenAbizena>
    </Nagusia>
    <LanpostuDeskribapen>Public Accountant</LanpostuDeskribapen>
    <Lanpostua idLanpostu="1"></Lanpostua>
  </Bulegaria>

  <Bulegaria id="13">
    <Izena>Selah</Izena>
    <Abizena>Barnes</Abizena>
    <Emaila>selah.barnes@example.com</Emaila>
    <Telefonoa>515.124.4169</Telefonoa>
    <Data>07/12/15</Data>
    <Nagusia nagusiID="9">
      <IzenAbizena>Fionnuala Bond</IzenAbizena>
    </Nagusia>
    <LanpostuDeskribapen>Public Accountant</LanpostuDeskribapen>
    <Lanpostua idLanpostu="1"></Lanpostua>
  </Bulegaria>

  <Bulegaria id="14">
    <Izena>Keziaha</Izena>
    <Abizena>Swanson</Abizena>
    <Emaila>keziaha.swanson@example.com</Emaila>
    <Telefonoa>515.124.4269</Telefonoa>
    <Data>29/01/16</Data>
    <Nagusia nagusiID="9">
      <IzenAbizena>Fionnuala Bond</IzenAbizena>
    </Nagusia>
    <LanpostuDeskribapen>Public Accountant</LanpostuDeskribapen>
    <Lanpostua idLanpostu="1"></Lanpostua>
  </Bulegaria>

  <Bulegaria id="15">
    <Izena>Geraldine</Izena>
    <Abizena>Schneider</Abizena>
    <Emaila>geraldine.schneider@example.com</Emaila>
    <Telefonoa>515.123.4444</Telefonoa>
    <Data>07/12/15</Data>
    <Nagusia nagusiID="100">
      <IzenAbizena>Fionnuala Bond</IzenAbizena>
    </Nagusia>
    <LanpostuDeskribapen>Marketing Manager</LanpostuDeskribapen>
    <Lanpostua idLanpostu="10"></Lanpostua>
  </Bulegaria>

  <Bulegaria id="16">
    <Izena>Alex</Izena>
    <Abizena>Sanders</Abizena>
    <Emaila>alex.sanders@example.com</Emaila>
    <Telefonoa>515.127.4562</Telefonoa>
    <Data>18/05/16</Data>
    <Nagusia nagusiID="47">
      <IzenAbizena>Selah Barnes</IzenAbizena>
    </Nagusia>
    <LanpostuDeskribapen>Shipping Clerk</LanpostuDeskribapen>
    <Lanpostua idLanpostu="17"></Lanpostua>
  </Bulegaria>

  <Bulegaria id="17">
    <Izena>Frederick</Izena>
    <Abizena>Price</Abizena>
    <Emaila>frederick.price@example.com</Emaila>
    <Telefonoa>515.127.4563</Telefonoa>
    <Data>24/12/16</Data>
    <Nagusia nagusiID="47">
      <IzenAbizena>Selah Barnes</IzenAbizena>
    </Nagusia>
    <LanpostuDeskribapen>Shipping Clerk</LanpostuDeskribapen>
    <Lanpostua idLanpostu="17"></Lanpostua>
  </Bulegaria>

  <Bulegaria id="18">
    <Izena>Ollie</Izena>
    <Abizena>Bennett</Abizena>
    <Emaila>ollie.bennett@example.com</Emaila>
    <Telefonoa>515.127.4564</Telefonoa>
    <Data>24/07/16</Data>
    <Nagusia nagusiID="47">
      <IzenAbizena>Selah Barnes</IzenAbizena>
    </Nagusia>
    <LanpostuDeskribapen>Shipping Clerk</LanpostuDeskribapen>
    <Lanpostua idLanpostu="17"></Lanpostua>
  </Bulegaria>

  <Bulegaria id="19">
    <Izena>Louis</Izena>
    <Abizena>Wood</Abizena>
    <Emaila>louis.wood@example.com</Emaila>
    <Telefonoa>515.127.4565</Telefonoa>
    <Data>15/11/16</Data>
    <Nagusia nagusiID="47">
      <IzenAbizena>Selah Barnes</IzenAbizena>
    </Nagusia>
    <LanpostuDeskribapen>Shipping Clerk</LanpostuDeskribapen>
    <Lanpostua idLanpostu="17"></Lanpostua>
  </Bulegaria>

  <Bulegaria id="20">
    <Izena>Dexter</Izena>
    <Abizena>Barnes</Abizena>
    <Emaila>dexter.barnes@example.com</Emaila>
    <Telefonoa>515.127.4566</Telefonoa>
    <Data>10/08/16</Data>
    <Nagusia nagusiID="47">
      <IzenAbizena>Selah Barnes</IzenAbizena>
    </Nagusia>
    <LanpostuDeskribapen>Shipping Clerk</LanpostuDeskribapen>
    <Lanpostua idLanpostu="17"></Lanpostua>
  </Bulegaria>

  <Bulegaria id="21">
    <Izena>Fionnuala</Izena>
    <Abizena>Bond</Abizena>
    <Emaila>fionnuala.bond@example.com</Emaila>
    <Telefonoa>515.123.8080</Telefonoa>
    <Data>21/09/15</Data>
    <Nagusia nagusiID="100">
      <IzenAbizena>Fionnuala Bond</IzenAbizena>
    </Nagusia>
    <LanpostuDeskribapen>Purchasing Manager</LanpostuDeskribapen>
    <Lanpostua idLanpostu="14"></Lanpostua>
  </Bulegaria>

  <Bulegaria id="22">
    <Izena>Keziaha</Izena>
    <Abizena>Swanson</Abizena>
    <Emaila>keziaha.swanson@example.com</Emaila>
    <Telefonoa>515.124.4169</Telefonoa>
    <Data>13/01/16</Data>
    <Nagusia nagusiID="100">
      <IzenAbizena>Fionnuala Bond</IzenAbizena>
    </Nagusia>
    <LanpostuDeskribapen>Purchasing Clerk</LanpostuDeskribapen>